{
  "pack_version": "1.0",
  "manifest": {
    "sha256": "",
    "built_at": ""
  },
  "chapter": {
    "subject": "Physical Science",
    "class": 9,
    "chapter_no": "[VERIFY]"
  },
  "chunks": [
    {
      "chunk_id": "BSE9-PHYS-MOTION-S02",
      "title_or": "[[ODIA_TITLE]]",
      "odia_text": "ଅଜଣା ଓଡ଼ିଆ ପାଠ୍ୟ ଯାହା ଟ୍ରାନ୍ସକ୍ରିପ୍ଟରେ ନାହିଁ",
      "terms": [],
      "source_page": 58,
      "status": "demo_approved",
      "reviewed_by": ""
    }
  ],
  "terms": [],
  "items": []
}
